{
  "schema_version": 2,
  "work_id": "add-retry-logic",
  "task": "Add retry logic to the API client",
  "current_state": "completed",
  "created_at": "2026-05-17T14:00:00Z",
  "updated_at": "2026-05-17T14:47:00Z",
  "budget": {
    "iteration_budget": 8,
    "budget_remaining": 5,
    "cost_budget_usd": 3.0,
    "cost_used": 1.84,
    "usage_totals": { "input_tokens": 184000, "output_tokens": 21000 }
  },
  "counters": { "self_review_iter": 0, "doubt_cycles": 1, "code_review_iter": 0 },
  "pipeline": { "track": "lean", "subagent_auto_select": true },
  "history": [
    { "at": "2026-05-17T14:00:00Z", "from": "initialized", "to": "feasibility",
      "actor": "hypervisor", "reason": "start", "cost_delta_usd": 0 },
    { "at": "2026-05-17T14:03:00Z", "from": "feasibility", "to": "lean-track-check",
      "actor": "hypervisor", "reason": "lean signal", "cost_delta_usd": 0.08,
      "evidence_refs": ["feasibility.md#L1-L20"] },
    { "at": "2026-05-17T14:04:00Z", "from": "lean-track-check", "to": "lean-track-implementation",
      "actor": "hypervisor", "reason": "verdict: simple", "cost_delta_usd": 0.04 },
    { "at": "2026-05-17T14:30:00Z", "from": "lean-track-implementation", "to": "validation",
      "actor": "developer", "reason": "implementation complete", "cost_delta_usd": 1.33,
      "evidence_refs": ["implementation.md"] },
    { "at": "2026-05-17T14:38:00Z", "from": "validation", "to": "pr-creation",
      "actor": "hypervisor", "reason": "tests green", "cost_delta_usd": 0.21 },
    { "at": "2026-05-17T14:40:00Z", "from": "pr-creation", "to": "approval-wait",
      "actor": "pr-manager", "reason": "PR opened", "cost_delta_usd": 0.18 },
    { "at": "2026-05-17T14:47:00Z", "from": "approval-wait", "to": "completed",
      "actor": "user", "reason": "approved by suraj", "cost_delta_usd": 0 }
  ]
}
